{
  "candidate_identity_sha256": "3b59c1d1984bd393ac0c2330fd6da540718a524156106948a430574cca6b31f8",
  "candidate_request_count": 187,
  "candidate_result_count": 439,
  "claims": {
    "corpus_complete": false,
    "permanent_unavailability_decided": false,
    "replay_executed": false,
    "state_append_authorized": false
  },
  "github_evidence_aggregate_sha256": "ba816b52558cf77bd202618f820ffa6294ca2167698c94ab1096a39375c50212",
  "inventory_sha256": "1a747133bba3c9ce09852967b4f3b4707bad64506890e4581bbf6f90a9be330c",
  "kind": "historical_public_replay_unavailability_candidate_manifest",
  "legacy_adjudication_registry_sha256": "4df6682b0e8b0ff129235c286aebf3322f37b002c846cc9fc8b14c054acf4ed1",
  "resolution_requests_sha256": "bf78ab88b8612c3aa1d627eb9efdda4c0989ef4d55451e706f825108e22f37de",
  "review_status": "required",
  "schema_version": 1,
  "shard_count": 6,
  "shards": [
    {
      "byte_count": 66811,
      "first_request_id": "prr_037a769a544dfb38b9d572fe11a7ad85bd8ab3e9cef0dafd6cadfe805b46dc68",
      "last_request_id": "prr_23665980829a3649754a6ed0303d28bb6bf554e1c85e16a65b4d9b61508e25c3",
      "request_count": 32,
      "result_count": 32,
      "sha256": "6c417aa24b90c10b37b7482dca594d1b4da9a607b8ce0acda86656e30e3f44e6",
      "shard_index": 0
    },
    {
      "byte_count": 140398,
      "first_request_id": "prr_2823240c46e7a43cc839fb232bc189b93699eea115ab2ff335f6cce94bfbd924",
      "last_request_id": "prr_537304eb55afb29d086e75b79923614feb6101bc0fc12244ea0a3af3c7362904",
      "request_count": 32,
      "result_count": 174,
      "sha256": "29f13d9480fa41dbb7ff9ed9dd0aaab9c8ab88411db65976b84f4b80ca5fe571",
      "shard_index": 1
    },
    {
      "byte_count": 74889,
      "first_request_id": "prr_572867ab6cba8db8c853f1b73a5e9e96e9e2c61436eba510c9ef63584f6413f6",
      "last_request_id": "prr_7e0440ad35a463d0c9180f1944c69481887752688ce54333379d30d5d15d7532",
      "request_count": 32,
      "result_count": 48,
      "sha256": "bc6a5a1b9c32470ac832bee4dc253b28b46c5c58246a7246847cbf32829ba5f2",
      "shard_index": 2
    },
    {
      "byte_count": 71485,
      "first_request_id": "prr_7e659169285202d1e584dd41f539d1211e4186a91ccee4696e82b0406bd4c855",
      "last_request_id": "prr_ad9d50c3a004aa9ba8c814be4f3392d9c9beac520c497c33a5b4130efb5f02b6",
      "request_count": 32,
      "result_count": 41,
      "sha256": "ba1f0964feb88d2b43fe76ded83f4acd58cf83fb70abbf34b1f587133e0685de",
      "shard_index": 3
    },
    {
      "byte_count": 109357,
      "first_request_id": "prr_af8840ead5aefbf0b4aedf93ad1820b8d0cfee811519633779ff2cf57b15598a",
      "last_request_id": "prr_db6cd9fa391abc50320356e7419e50f091ae2cdbaede15152af78dd90c0f1a43",
      "request_count": 32,
      "result_count": 117,
      "sha256": "891f9cbf161548ba97133bb5fa9dd1818ffc611f400f2d95e5978352ac3ff7b0",
      "shard_index": 4
    },
    {
      "byte_count": 56522,
      "first_request_id": "prr_dc20dac96aa390a2208f076c85ebf1f5f48f1726927b6b1847f1dc8d957234d4",
      "last_request_id": "prr_fd484d94473c79bfa99139c70737ed3cfb71db086888a81adf8fd1d236ab31cd",
      "request_count": 27,
      "result_count": 27,
      "sha256": "d9470b6585aec1868aa3476e2d5acea5a11c85d7ac1815f4b69f46c728836513",
      "shard_index": 5
    }
  ],
  "source_commit": "ba5f5784427621f8b9be7396dd45a0938792707d",
  "source_repository": "leanprover/lean-eval-submissions",
  "workflow_definition_registry_sha256": "b9004ee87f0ff032e78198e251b87fe1bb1d0baaf77d6ea853335dd1f5487108"
}
